{"atlas_root":"sha256:339c5569ae2389de7c0467728fc5dab292587c0e2cf03958375948aae590af2c","compiler":{"product":"xinfa","version":"0.1.0"},"context_pack_root":"sha256:5c904179cbbe89fccfef06442fed2afba9217dc6fc9ffb8c633256b0e47f52f8","diagnostics":[],"manifest_root":"sha256:74d265b1a3f752fa680f17de7066da63f8719679ad5ed8411573c728e0234850","qualifying":false,"receipt_root":"sha256:3f56212d95c9f04cab650f0bb59a9f2f6edb0256c50de97904e11e288a589eb0","schema":"xinfa.atlas-compile-receipt/v1","selfCertified":false,"verdict":"pass","writesCache":false}
