{"atlas_root":"sha256:05631a8dbd39a881897c5a10f720422feb677306a1b96b5d829db415aaad91d8","compiler":{"product":"xinfa","version":"0.1.0"},"context_pack_root":"sha256:f64c02092f4ad72b13243f0767730818ae3de2120cc17988e616f1dfd7e314e3","diagnostics":[],"manifest_root":"sha256:8c37e5d248991550e7591459e8a1170eb592b17a0cd83dcaac6e5541d8be7b88","qualifying":false,"receipt_root":"sha256:a3184f9fce184c2ecbc025a1af645072626213fccd34803dcbd2c6c6c0f357e5","schema":"xinfa.atlas-compile-receipt/v1","selfCertified":false,"verdict":"pass","writesCache":false}
