{"atlas_root":"sha256:16f5be97d4524ac3d64a4037e6aeb6939d081155ca1e93fc41cccb3226ee2007","compiler":{"product":"xinfa","version":"0.1.0"},"context_pack_root":"sha256:9a7cbd6d3562ccf325462ad7eba3643a4d5030ef682f3d6a43fb669e9da63ea0","diagnostics":[],"manifest_root":"sha256:0fafa336c866afa28c647de6bbb3f0b676f5844b7b37ced23333793b2d9d709d","qualifying":false,"receipt_root":"sha256:74cd1c0ed27163dbdc981890f2b07fcb08c8c67f00949cf59df7407ef6a974a8","schema":"xinfa.atlas-compile-receipt/v1","selfCertified":false,"verdict":"pass","writesCache":false}
