{"atlas_root":"sha256:7e7d8082dc15c1f5c104a4930b78a54ce4425f15d1b764e4fbee880a928d536e","compiler":{"product":"xinfa","version":"0.1.0"},"context_pack_root":"sha256:b0cae43710b860b6be10ca67379e57b835ba4a85a5b9225122ab5b3a9f1f578a","diagnostics":[],"manifest_root":"sha256:d3f069e4c64a7233b497920e77da08d6b199ee14f44d9d385e2f16f8213b8ebd","qualifying":false,"receipt_root":"sha256:70e95a11a58e0aebc720153a56de90108d5ad38e1ba889725ad8f92ed0d22e38","schema":"xinfa.atlas-compile-receipt/v1","selfCertified":false,"verdict":"pass","writesCache":false}
