{"atlas_root":"sha256:15ea26751b5d56ef9f790c1d3a61ddc52ee69e0d58c0e8b2e7663478cd1ab563","compiler":{"product":"xinfa","version":"0.1.0"},"context_pack_root":"sha256:953f7ff9fba69bb22ba00e4294fd52efee006e9619c3562c004eb6f1baf8cec7","diagnostics":[],"manifest_root":"sha256:871f9a7c7ca49cbe04db9ebf988b3ae6a26e4630d99b45109c236e46bc7b3c87","qualifying":false,"receipt_root":"sha256:b97a88165394de6d7ae73764f3a30630bf42f8fd472bb26aee64be6609e4a137","schema":"xinfa.atlas-compile-receipt/v1","selfCertified":false,"verdict":"pass","writesCache":false}
