{"atlas_root":"sha256:c71ebfcf37d0e9f5bed50744d9858262df43d20acd5a58966654b7dfcbfc039e","compiler":{"product":"xinfa","version":"0.1.0"},"context_pack_root":"sha256:a4e0d8fffd5449eddf6c7e9522c939d4f1aae919d5dc40ca8ce00c8b18c01d6a","diagnostics":[],"manifest_root":"sha256:1b2438f4968f5ad565051b898a01499dccd7475c45ad29262650237798aed3be","qualifying":false,"receipt_root":"sha256:c1e5b80dd00e5f9431f54d1a87edc038d78c1dbebacf17c44f255e32904f0795","schema":"xinfa.atlas-compile-receipt/v1","selfCertified":false,"verdict":"pass","writesCache":false}
