{"atlas_root":"sha256:f1eb60f36dafe016818ffc9040d5acb32d25676432a63aa116e5252144fdd8cb","compiler":{"product":"xinfa","version":"0.1.0"},"context_pack_root":"sha256:1bf8c4a463599758b8c0183972143896097f920d1260009c9f1a8d8df44a6f69","diagnostics":[],"manifest_root":"sha256:f4f3e8c7e2b145b2c3644e4c8a3f692b26a6f16ed816cdb6176fb3b81e623303","qualifying":false,"receipt_root":"sha256:11112fc2cee0bfacf4dd23741e7c418c38b25b2118bbc6296f5956e66e155e98","schema":"xinfa.atlas-compile-receipt/v1","selfCertified":false,"verdict":"pass","writesCache":false}
