{"atlas_root":"sha256:645715e41e7bb90fbb1f9231135277dc9d78065e3f31a04608d452020e76a694","compiler":{"product":"xinfa","version":"0.1.0"},"context_pack_root":"sha256:6a4ec79a2a0996b097ba13d94b70692509907907e649d6bb5ad3a40438246536","diagnostics":[],"manifest_root":"sha256:fa593d24fee74266749b0e764bfb26b3937d4c598ab5eb1d57bb19f0fa29d63f","qualifying":false,"receipt_root":"sha256:187efbc130d878c65d414bc6bcdd170cf086f71a648ba3fa677831ed0e100322","schema":"xinfa.atlas-compile-receipt/v1","selfCertified":false,"verdict":"pass","writesCache":false}
