{
  "atlas_root": "sha256:cb5266a759d05c40e7415b98962baec6b3ba08424e0aa4f3c7cc8d681cba3080",
  "compiler": {
    "product": "xinfa",
    "version": "4.0.0-alpha.1"
  },
  "context_pack_root": "sha256:e8c1aa7c9a3f89bb9245df90974a18002a5054b89f37fe224d59b015139262dd",
  "diagnostics": [],
  "manifest_root": "sha256:d9f364ef6c8a2a7ba69b40f90fb29c7040f5a6492bdb4054bc88feec0d841595",
  "qualifying": false,
  "receipt_root": "sha256:49ae98de8c968da0bdfaefa4050a9cf233d8162add1ab1f0f49edf5f1689dca9",
  "schema": "xinfa.atlas-compile-receipt/v1",
  "selfCertified": false,
  "verdict": "pass",
  "writesCache": false
}
