{"atlas_root":"sha256:27207b71040b5ca8d37e6a4eab0264eb434ebf3b5bacec8da60e1f290b36dffc","compiler":{"product":"xinfa","version":"0.1.0"},"context_pack_root":"sha256:947ef3eb043a2f62157523a1a888d08550f301749df45b2079908b2748bfd0bd","diagnostics":[],"manifest_root":"sha256:16e615e1f4f63c1622acd3d60db5b1a4a5c71a6799bb70ba97a630288121be3d","qualifying":false,"receipt_root":"sha256:6bf0cab8f64efc85c0efa49a24ab7beed61503a2dc1d2f828649b5947f2e4933","schema":"xinfa.atlas-compile-receipt/v1","selfCertified":false,"verdict":"pass","writesCache":false}
