{"atlas_root":"sha256:1412925cbf4dd639061cc3f5f27065c40bfb4458826b29fd9a805938b7fecf7a","compiler":{"product":"xinfa","version":"0.1.0"},"context_pack_root":"sha256:ed5fda0af6645f20f220344ce57968b21b48174659e8d1a9534401f349654c11","diagnostics":[],"manifest_root":"sha256:10c1b2e4524cfea75482610dd80b93bc966b8f87ec531573d35bc1e2ef377214","qualifying":false,"receipt_root":"sha256:393d36e26396f424baa273a1d157154e9b55a6c37e434825c97d393e5c2022ad","schema":"xinfa.atlas-compile-receipt/v1","selfCertified":false,"verdict":"pass","writesCache":false}
