{"atlas_root":"sha256:aa199e7179b28695107c1fc7626e4d0d6517a67542376757a6ed3d5bec3e64ec","compiler":{"product":"xinfa","version":"0.1.0"},"context_pack_root":"sha256:dfc90c89a440c6486ee62106debb4f68ea3af22f0c56336efbd7881e936ea43d","diagnostics":[],"manifest_root":"sha256:5d8de5890c43c573830256ed4c1558bfeca2557cc8e050d1b7c52b51960332e9","qualifying":false,"receipt_root":"sha256:15152fa68408d01676b081d38b7c3d595c3a7edb31fbbdb240cc7f31d073c08c","schema":"xinfa.atlas-compile-receipt/v1","selfCertified":false,"verdict":"pass","writesCache":false}
