{"atlas_root":"sha256:87fe9881ce7e384c2a19ab732e420045e3bf51f563c3d74b863cc02056378979","compiler":{"product":"xinfa","version":"0.1.0"},"context_pack_root":"sha256:f89d05e336c3516891e902db1d62d54dbe37b6fb09b8ca93f5df669e3bb5dfe5","diagnostics":[],"manifest_root":"sha256:18bcf59caa4c50cc54b279819ecaf0ae80cc6fd65ddf1eacb5c44b36966f6dc6","qualifying":false,"receipt_root":"sha256:535612102868a0e9ddc3352f2df5d183a9138003c48f07df088fcd783730cc8d","schema":"xinfa.atlas-compile-receipt/v1","selfCertified":false,"verdict":"pass","writesCache":false}
