{"atlas_root":"sha256:ef40545fcf84d776f9be6c8eefa4734228c4b84e8e079ffdeb832f79e283acb7","compiler":{"product":"xinfa","version":"0.1.0"},"context_pack_root":"sha256:d91094436c3957fed22396f506b677332b4192588313f63537e3727a33fa5d38","diagnostics":[],"manifest_root":"sha256:e322d174273b354b3298d3f2950a38aec653d2410bfdf32941fadbab07a9c6ba","qualifying":false,"receipt_root":"sha256:61e02f1c9e813e67c418a37e6a3cec1f981efcf1cb2dd4bd31297cfeed00dd3c","schema":"xinfa.atlas-compile-receipt/v1","selfCertified":false,"verdict":"pass","writesCache":false}
