{"atlas_root":"sha256:a2cafdf531835a51598dad7cc6de2825430d36e8ceec05b51d96a3a005c8d548","compiler":{"product":"xinfa","version":"0.1.0"},"context_pack_root":"sha256:027a69186ab1d60f1637520e377cde889b5bfdc5c522caad594dc5cff4972ed3","diagnostics":[],"manifest_root":"sha256:5969357291937b977b05ffd18f5e20159ca274ab23d17cf4c05c0241f41b6c0e","qualifying":false,"receipt_root":"sha256:8cd4b4478d803e72c92b621d37c16a5830b7830ce5026a44d5b380abedd7b868","schema":"xinfa.atlas-compile-receipt/v1","selfCertified":false,"verdict":"pass","writesCache":false}
