{"atlas_root":"sha256:23efbe0419fa14bb090fb091d295129e9be4c1d37fae9772a04ead4843531c25","compiler":{"product":"xinfa","version":"0.1.0"},"context_pack_root":"sha256:9248f43a8ec3bd19393d0298737e29906c834d4aa9db72d09f92721c6072b77e","diagnostics":[],"manifest_root":"sha256:32674f5b1c22490f3cf6933caaed78ae098ef362b2a439fec3e70de91bb8b3a8","qualifying":false,"receipt_root":"sha256:c8de72f5cb01c301e87b08460824fc6d13c1ff2303fc727c80bf1503427c2f05","schema":"xinfa.atlas-compile-receipt/v1","selfCertified":false,"verdict":"pass","writesCache":false}
