{"atlas_root":"sha256:99d45d5f1b733024bc3db171265351b15a64a030385999113cf55abb7b09f9a9","compiler":{"product":"xinfa","version":"0.1.0"},"context_pack_root":"sha256:b7b00436ffd14f69f45936ff7673c79e456f57c7de264d9e22cd3026a3853ceb","diagnostics":[],"manifest_root":"sha256:3ae0090e1bfa5c83f24e419eb556c93e8d920f837074644fc6d9195b04b49f5a","qualifying":false,"receipt_root":"sha256:9239984e505632366a26aa5adc36506284e7dae7d28a04cc6f70e8efde7c3000","schema":"xinfa.atlas-compile-receipt/v1","selfCertified":false,"verdict":"pass","writesCache":false}
